{
  "schemaVersion": 1,
  "kind": "steamzero-experience-planning-catalog",
  "updatedAt": "2026-10-16",
  "sourceCommit": "52131b87",
  "publicationPolicy": "Somente planejamento. Não carregar este catálogo como capability de runtime. Estados operacionais em docs/status/items e nos adapters observados.",
  "commonCapabilities": [
    "Sessão e retorno",
    "Compartilhamento conforme provider",
    "Saves/checkpoints somente quando suportados",
    "Capturas e galerias conforme backend",
    "Dados, mídia e manuais",
    "Instâncias visuais componíveis no Studio"
  ],
  "features": {
    "drives": {
      "label": "Discos, unidades e troca contextual",
      "deliveryItem": "SZ-EXPERIENCE-MULTIDRIVE-UX",
      "status": "proposal",
      "requires": "Prova no runtime/versão/plataforma/jogo/host pertinentes; não habilitar por nome da família."
    },
    "nfc": {
      "label": "NFC e Amiibo por runtime",
      "deliveryItem": "SZ-EXPERIENCE-PERIPHERALS",
      "status": "proposal",
      "requires": "Prova no runtime/versão/plataforma/jogo/host pertinentes; não habilitar por nome da família."
    },
    "cards": {
      "label": "Cartões e-Reader e acessórios equivalentes",
      "deliveryItem": "SZ-EXPERIENCE-PERIPHERALS",
      "status": "proposal",
      "requires": "Prova no runtime/versão/plataforma/jogo/host pertinentes; não habilitar por nome da família."
    },
    "sensors": {
      "label": "Touch, movimento, câmera e microfone",
      "deliveryItem": "SZ-EXPERIENCE-PERIPHERALS",
      "status": "proposal",
      "requires": "Prova no runtime/versão/plataforma/jogo/host pertinentes; não habilitar por nome da família."
    },
    "link": {
      "label": "Link entre instâncias ou dispositivos",
      "deliveryItem": "SZ-EXPERIENCE-PERIPHERALS",
      "status": "proposal",
      "requires": "Prova no runtime/versão/plataforma/jogo/host pertinentes; não habilitar por nome da família."
    },
    "players": {
      "label": "Participantes, controles e remapeamento",
      "deliveryItem": "SZ-EXPERIENCE-PERIPHERALS",
      "status": "proposal",
      "requires": "Prova no runtime/versão/plataforma/jogo/host pertinentes; não habilitar por nome da família."
    },
    "lightgun": {
      "label": "Mira e calibração por jogo",
      "deliveryItem": "SZ-EXPERIENCE-PERIPHERALS",
      "status": "proposal",
      "requires": "Prova no runtime/versão/plataforma/jogo/host pertinentes; não habilitar por nome da família."
    },
    "keypad": {
      "label": "Teclado numérico e overlays de controle",
      "deliveryItem": "SZ-EXPERIENCE-PERIPHERALS",
      "status": "proposal",
      "requires": "Prova no runtime/versão/plataforma/jogo/host pertinentes; não habilitar por nome da família."
    },
    "keyboard": {
      "label": "Teclado, mouse e atalhos contextuais",
      "deliveryItem": "SZ-EXPERIENCE-PERIPHERALS",
      "status": "proposal",
      "requires": "Prova no runtime/versão/plataforma/jogo/host pertinentes; não habilitar por nome da família."
    },
    "memory": {
      "label": "Memory cards e persistência por jogo/jogador",
      "deliveryItem": "SZ-EXPERIENCE-SAVES-REPLAY",
      "status": "proposal",
      "requires": "Prova no runtime/versão/plataforma/jogo/host pertinentes; não habilitar por nome da família."
    },
    "vmu": {
      "label": "Memory card e display VMU por participante",
      "deliveryItem": "SZ-EXPERIENCE-PERIPHERALS",
      "status": "proposal",
      "requires": "Prova no runtime/versão/plataforma/jogo/host pertinentes; não habilitar por nome da família."
    },
    "gc-gba": {
      "label": "Sessão composta GameCube e GBA",
      "deliveryItem": "SZ-EXPERIENCE-PERIPHERALS",
      "status": "proposal",
      "requires": "Prova no runtime/versão/plataforma/jogo/host pertinentes; não habilitar por nome da família."
    },
    "dualscreen": {
      "label": "Telas e superfícies independentes",
      "deliveryItem": "SZ-EXPERIENCE-PERIPHERALS",
      "status": "proposal",
      "requires": "Prova no runtime/versão/plataforma/jogo/host pertinentes; não habilitar por nome da família."
    },
    "network": {
      "label": "Multiplayer por rede conforme runtime",
      "deliveryItem": "SZ-EXPERIENCE-PERIPHERALS",
      "status": "proposal",
      "requires": "Prova no runtime/versão/plataforma/jogo/host pertinentes; não habilitar por nome da família."
    },
    "packs": {
      "label": "Packs gráficos, texturas e patches compatíveis",
      "deliveryItem": "SZ-EXPERIENCE-ENHANCEMENTS-UX",
      "status": "proposal",
      "requires": "Prova no runtime/versão/plataforma/jogo/host pertinentes; não habilitar por nome da família."
    },
    "mods": {
      "label": "Conteúdo extra, engine e ordem de mods",
      "deliveryItem": "SZ-EXPERIENCE-ENHANCEMENTS-UX",
      "status": "proposal",
      "requires": "Prova no runtime/versão/plataforma/jogo/host pertinentes; não habilitar por nome da família."
    },
    "presentation": {
      "label": "Apresentação original e melhorada por perfil",
      "deliveryItem": "SZ-EXPERIENCE-COMPOSITION",
      "status": "proposal",
      "requires": "Prova no runtime/versão/plataforma/jogo/host pertinentes; não habilitar por nome da família."
    },
    "rotation": {
      "label": "Orientação com foco e controles coerentes",
      "deliveryItem": "SZ-EXPERIENCE-COMPOSITION",
      "status": "proposal",
      "requires": "Prova no runtime/versão/plataforma/jogo/host pertinentes; não habilitar por nome da família."
    },
    "stereo": {
      "label": "Estereoscopia e alternativas de apresentação",
      "deliveryItem": "SZ-EXPERIENCE-COMPOSITION",
      "status": "proposal",
      "requires": "Prova no runtime/versão/plataforma/jogo/host pertinentes; não habilitar por nome da família."
    },
    "companion": {
      "label": "Manuais e contexto do jogo",
      "deliveryItem": "SZ-EXPERIENCE-COMPOSITION",
      "status": "proposal",
      "requires": "Prova no runtime/versão/plataforma/jogo/host pertinentes; não habilitar por nome da família."
    },
    "clock": {
      "label": "Relógio e tempo conforme dispositivo emulado",
      "deliveryItem": "SZ-EXPERIENCE-PERIPHERALS",
      "status": "proposal",
      "requires": "Prova no runtime/versão/plataforma/jogo/host pertinentes; não habilitar por nome da família."
    },
    "display": {
      "label": "Saídas, proporção e áudio por dispositivo",
      "deliveryItem": "SZ-EXPERIENCE-PERIPHERALS",
      "status": "proposal",
      "requires": "Prova no runtime/versão/plataforma/jogo/host pertinentes; não habilitar por nome da família."
    },
    "cloud": {
      "label": "Sessão web, autenticação e reconexão",
      "deliveryItem": "SZ-EXPERIENCE-PLATFORM-CATALOG",
      "status": "proposal",
      "requires": "Prova no runtime/versão/plataforma/jogo/host pertinentes; não habilitar por nome da família."
    },
    "machine": {
      "label": "Perfis de máquina e expansão por título",
      "deliveryItem": "SZ-EXPERIENCE-PLATFORM-CATALOG",
      "status": "proposal",
      "requires": "Prova no runtime/versão/plataforma/jogo/host pertinentes; não habilitar por nome da família."
    },
    "tape": {
      "label": "Fita, posição e autoload por receita",
      "deliveryItem": "SZ-EXPERIENCE-PERIPHERALS",
      "status": "proposal",
      "requires": "Prova no runtime/versão/plataforma/jogo/host pertinentes; não habilitar por nome da família."
    },
    "midi": {
      "label": "Saída MIDI opcional por perfil",
      "deliveryItem": "SZ-EXPERIENCE-PERIPHERALS",
      "status": "proposal",
      "requires": "Prova no runtime/versão/plataforma/jogo/host pertinentes; não habilitar por nome da família."
    },
    "arcade": {
      "label": "Créditos, start e configuração por máquina",
      "deliveryItem": "SZ-EXPERIENCE-PERIPHERALS",
      "status": "proposal",
      "requires": "Prova no runtime/versão/plataforma/jogo/host pertinentes; não habilitar por nome da família."
    },
    "carts": {
      "label": "Cartuchos de fantasy console e runtime",
      "deliveryItem": "SZ-EXPERIENCE-PLATFORM-CATALOG",
      "status": "proposal",
      "requires": "Prova no runtime/versão/plataforma/jogo/host pertinentes; não habilitar por nome da família."
    },
    "readiness": {
      "label": "Prontidão e compatibilidade por jogo/runtime",
      "deliveryItem": "SZ-EXPERIENCE-PLATFORM-CATALOG",
      "status": "proposal",
      "requires": "Prova no runtime/versão/plataforma/jogo/host pertinentes; não habilitar por nome da família."
    }
  },
  "sources": {
    "px68k": {
      "url": "https://docs.libretro.com/library/px68k/",
      "supports": "Troca de discos e seleção de unidade; verificar limites de save-state do core.",
      "checkedAt": "2026-10-16"
    },
    "puae": {
      "url": "https://docs.libretro.com/library/puae/",
      "supports": "M3U, disk control, multidrive e perfis Amiga.",
      "checkedAt": "2026-10-16"
    },
    "mgba": {
      "url": "https://github.com/mgba-emu/mgba/blob/master/README.md",
      "supports": "e-Reader, link e recursos declarados pelo upstream; não implica disponibilidade em cada frontend.",
      "checkedAt": "2026-10-16"
    },
    "sameboy": {
      "url": "https://sameboy.github.io/features/",
      "supports": "Link e acessórios com restrições explícitas por frontend; estudar alternativa Linux antes de escolher.",
      "checkedAt": "2026-10-16"
    },
    "dolphin-gba": {
      "url": "https://dolphin-emu.org/blog/2021/07/21/integrated-gba/",
      "supports": "Integração GameCube/GBA; desempenho e configuração SteamZero ainda precisam de prova.",
      "checkedAt": "2026-10-16"
    },
    "dolphin-controls": {
      "url": "https://dolphin-emu.org/docs/guides/configuring-controllers/",
      "supports": "Wiimote emulado e configuração de controles.",
      "checkedAt": "2026-10-16"
    },
    "cemu-packs": {
      "url": "https://cemu-project.github.io/cemu_graphic_packs/",